id,competitor,product_category,product_name,specification,price,unit_price,title,content,source,publish_time,url,dimension
hbc001,河北黄瓜,vegetable,黄瓜,精品 5kg,17.6,3.52元/kg,河北黄瓜批发价低于寿光货源,河北黄瓜精品货到货价低于山东寿光黄瓜0.18元/kg，短期具备采购替代优势。,手工公开样例,2026-07-01,https://manual.local/wholesale/hebei-cucumber/hbc001,price
hbc002,河北黄瓜,vegetable,黄瓜,统货 5kg,14.9,2.98元/kg,河北黄瓜统货低价到货,河北黄瓜统货批发价低于寿光统货，适合价格敏感型批发客户采购。,手工公开样例,2026-07-01,https://manual.local/wholesale/hebei-cucumber/hbc002,price
hbc003,河北黄瓜,vegetable,黄瓜,精品 5kg,18.2,3.64元/kg,河北降雨影响黄瓜采收,河北部分产区降雨导致采收节奏放缓，精品黄瓜报价较昨日上涨0.12元/kg。,手工公开样例,2026-07-02,https://manual.local/wholesale/hebei-cucumber/hbc003,price
hbc004,河北黄瓜,vegetable,黄瓜,精品 5kg,18.7,3.74元/kg,河北黄瓜价差优势收窄,河北黄瓜到货价上行，和山东寿光黄瓜的价差缩小，建议降低单一货源依赖。,手工公开样例,2026-07-03,https://manual.local/wholesale/hebei-cucumber/hbc004,price
hbc005,河北黄瓜,vegetable,黄瓜,统货 5kg,15.2,3.04元/kg,河北统货适合补量采购,河北黄瓜统货仍保持低价，适合在寿光精品货价格上行时补量采购。,手工公开样例,2026-07-03,https://manual.local/wholesale/hebei-cucumber/hbc005,price
