id,competitor,product_category,product_name,specification,price,unit_price,title,content,source,publish_time,url,dimension
sgc001,山东寿光黄瓜,vegetable,黄瓜,精品 5kg,18.5,3.70元/kg,寿光黄瓜批发价小幅下探,山东寿光黄瓜精品货批发价较昨日下调0.2元/kg，到货量增加，适合作为本周采购基准价。,手工公开样例,2026-07-01,https://manual.local/wholesale/shouguang-cucumber/sgc001,price
sgc002,山东寿光黄瓜,vegetable,黄瓜,统货 5kg,15.8,3.16元/kg,寿光黄瓜统货供应充足,寿光产区黄瓜统货供应稳定，价格低于精品货0.54元/kg，适合对价格敏感的批发采购。,手工公开样例,2026-07-01,https://manual.local/wholesale/shouguang-cucumber/sgc002,price
sgc003,山东寿光黄瓜,vegetable,黄瓜,精品 5kg,18.9,3.78元/kg,寿光黄瓜到货价回升,受周边市场补货影响，寿光黄瓜到货价较前一日回升0.08元/kg，需关注后续价差变化。,手工公开样例,2026-07-02,https://manual.local/wholesale/shouguang-cucumber/sgc003,price
sgc004,山东寿光黄瓜,vegetable,黄瓜,精品 5kg,19.2,3.84元/kg,寿光黄瓜精品货采购窗口收窄,寿光黄瓜精品货报价继续上行，和河北黄瓜价差扩大，短期采购优势减弱。,手工公开样例,2026-07-03,https://manual.local/wholesale/shouguang-cucumber/sgc004,price
sgc005,山东寿光黄瓜,vegetable,黄瓜,统货 5kg,16.1,3.22元/kg,寿光黄瓜统货仍具备备货价值,寿光黄瓜统货价格维持低位，适合作为混批渠道的补充货源。,手工公开样例,2026-07-03,https://manual.local/wholesale/shouguang-cucumber/sgc005,price
